[
  {
    "id": "spell:acid-splash",
    "name": "Acid Splash",
    "description": "You hurl a bubble of acid. Choose one creature within range, or choose two creatures within range that are within 5 feet of each other. A target must succeed on a Dexterity saving throw or take 1d6 acid damage.",
    "level": 0,
    "casting_time": "Action",
    "components": ["Verbal", "Somatic"],
    "classes": ["Sorcerer", "Wizard"],
    "school": "Conjuration",
    "range": "Range",
    "distance": 60,
    "duration": 0,
    "concentration": false,
    "damage": {
      "dice": "1d6",
      "type": ["acid"]
    },
    "scaling": {
      "components": {
        "damage": {
          "by_level": {
            "5": "2d6",
            "11": "3d6",
            "17": "4d6"
          }
        }
      }
    },
    "mechanics": [
      {
        "type": "action",
        "target": {
          "type": "creatures",
          "count": 2,
          "disposition": "hostile",
          "proximity": 5
        },
        "effects": [
          {
            "saving_throw": {
              "ability": ["Dexterity"],
              "dc": {
                "ref": "spell_save_dc"
              }
            },
            "on_failure": {
              "damage": {
                "dice": "scaling.damage",
                "type": ["acid"]
              }
            },
            "on_success": {
              "damage": {
                "calculation": {
                  "operation": "multiply",
                  "operators": [
                    {
                      "type": "integer",
                      "value": 0
                    }
                  ]
                }
              }
            }
          }
        ]
      }
    ],
    "source": "phb",
    "ruleset": "dnd5e"
  },
  {
    "id": "spell:blade-ward",
    "name": "Blade Ward",
    "description": "You extend your hand and trace a sigil of warding in the air. Until the end of your next turn, you have resistance against bludgeoning, piercing, and slashing damage dealt by weapon attacks.",
    "level": 0,
    "casting_time": "Action",
    "components": ["Verbal", "Somatic"],
    "classes": ["Bard", "Sorcerer", "Warlock", "Wizard"],
    "school": "Abjuration",
    "range": "Touch",
    "duration": 1,
    "concentration": false,
    "resistances": ["bludgeoning", "piercing", "slashing"],
    "mechanics": [
      {
        "type": "action",
        "target": {
          "type": "self"
        },
        "effects": [
          {
            "damage_response": {
              "category": "resistance",
              "to": ["bludgeoning", "piercing", "slashing"],
              "source": {
                "type": ["weapon"]
              }
            },
            "duration": {
              "value": 1,
              "unit": "turns"
            }
          }
        ]
      }
    ],
    "source": "phb",
    "ruleset": "dnd5e"
  },
  {
    "id": "spell:booming-blade",
    "name": "Booming Blade",
    "description": "You brandish the weapon used in the spell's casting and make a melee attack with it against one creature within 5 feet of you. On a hit, the target suffers the weapon attack's normal effects and then becomes sheathed in booming energy until the start of your next turn. If the target willingly moves 5 feet or more before then, the target takes 1d8 thunder damage, and the spell ends.",
    "level": 0,
    "casting_time": "Action",
    "components": ["Somatic", "Material"],
    "materials": [
      {
        "name": "A melee weapon",
        "consumed": false,
        "cost": {
          "amount": 1,
          "currency": "SP"
        }
      }
    ],
    "classes": ["Sorcerer", "Warlock", "Wizard"],
    "school": "Evocation",
    "range": "Self",
    "distance": 5,
    "duration": 1,
    "concentration": false,
    "scaling": {
      "components": {
        "damage": {
          "by_level": {
            "5": "1d8",
            "11": "2d8",
            "17": "3d8"
          }
        },
        "move": {
          "by_level": {
            "1": "1d8",
            "5": "2d8",
            "11": "3d8",
            "17": "4d8"
          }
        }
      }
    },
    "mechanics": [
      {
        "type": "action",
        "target": {
          "type": "creature",
          "count": 1
        },
        "effects": [
          {
            "on_hit": {
              "damage": {
                "source": "weapon"
              },
              "additional_damage": {
                "dice": "scaling.damage",
                "type": ["thunder"]
              },
              "apply_status": {
                "id": "status:booming_blade",
                "effect": {
                  "trigger": {
                    "event": ["action"],
                    "action": "move",
                    "condition": {
                      "type": "movement",
                      "value": 5,
                      "unit": "feet"
                    }
                  },
                  "damage": {
                    "dice": "scaling.move",
                    "type": ["thunder"]
                  }
                },
                "duration": {
                  "value": 1,
                  "unit": "turns",
                  "timing": "start_turn"
                }
              }
            }
          }
        ]
      }
    ],
    "source": "tce",
    "ruleset": "dnd5e"
  },
  {
    "id": "spell:chill-touch",
    "name": "Chill Touch",
    "description": "You create a ghostly, skeletal hand in the space of a creature within range. Make a ranged spell attack against the creature to assail it with the chill of the grave. On a hit, the target takes 1d8 necrotic damage, and it can't regain hit points until the start of your next turn. If you hit an undead target, it also has disadvantage on attack rolls against you until the end of your next turn.",
    "level": 0,
    "casting_time": "Action",
    "components": ["Verbal", "Somatic"],
    "classes": ["Sorcerer", "Warlock", "Wizard"],
    "school": "Necromancy",
    "range": "Range",
    "distance": 120,
    "duration": 1,
    "concentration": false,
    "damage": {
      "dice": "1d8",
      "type": ["necrotic"]
    },
    "scaling": {
      "components": {
        "damage": {
          "by_level": {
            "5": "2d8",
            "11": "3d8",
            "17": "4d8"
          }
        }
      }
    },
    "mechanics": [
      {
        "type": "action",
        "effects": [
          {
            "attack": {
              "source": {
                "type": "spell"
              }
            },
            "on_hit": {
              "damage": {
                "dice": "scaling.damage",
                "type": ["necrotic"]
              },
              "apply_status": {
                "id": "status:healing_blocked",
                "duration": {
                  "value": 1,
                  "unit": "turns",
                  "timing": "start_turn",
                  "to": "event_actor"
                }
              }
            }
          },
          {
            "target": {
              "type": "creature",
              "requirements": [
                {
                  "type": "creature_type",
                  "value": ["Undead"]
                }
              ]
            },
            "on_hit": {
              "apply_status": {
                "id": "status:chill_touched",
                "effect": {
                  "disadvantage": {
                    "attack": "all",
                    "against": {
                      "source": "character"
                    }
                  }
                },
                "duration": {
                  "value": 1,
                  "unit": "turns"
                }
              }
            }
          }
        ]
      }
    ],
    "source": "phb",
    "ruleset": "dnd5e"
  },
  {
    "id": "spell:control-flames",
    "name": "Control Flames",
    "description": "You choose nonmagical flame that you can see within range and that fits within a 5-foot cube. You affect it in one of the following ways: You instantaneously expand the flame 5 feet in one direction, provided that wood or other fuel is present in the new location. You instantaneously extinguish the flames within the cube. You double or halve the area of bright light and dim light cast by the flame, change its color, or both. The change lasts for 1 hour. You cause simple shapes\u2014such as the vague form of a creature, an inanimate object, or a location\u2014to appear within the flames and animate as you like. The shapes last for 1 hour.",
    "level": 0,
    "casting_time": "Action",
    "components": ["Somatic"],
    "classes": ["Druid", "Sorcerer", "Wizard"],
    "school": "Transmutation",
    "range": "Range",
    "distance": 60,
    "duration": 0,
    "concentration": false,
    "mechanics": [
      {
        "type": "action",
        "target": {
          "type": "object",
          "value": ["fire"],
          "requirements": [
            {
              "type": "property",
              "value": "magical",
              "negate": true
            },
            {
              "type": "area",
              "area": {
                "shape": "cube",
                "size": 5,
                "unit": "feet"
              },
              "comparison": "at_most"
            }
          ]
        },
        "effects": [
          {
            "choice": {
              "options": [
                {
                  "name": "expand",
                  "effect": {
                    "manipulate": {
                      "model": "lighting",
                      "operation": "create"
                    },
                    "target": {
                      "type": "point",
                      "requirements": [
                        {
                          "type": "property",
                          "value": "fuel",
                          "negate": true